{
  "schema_version": 1,
  "id": "catalog-fixture",
  "version": 2,
  "lang": "ru",
  "topic": "infosec",
  "title": "Фикстура каталога",
  "description": "Все шесть типов вопросов, все знания approved.",
  "sources": [
    {
      "id": "src-a",
      "title": "Источник A",
      "url": "https://example.org/a",
      "license": "CC BY-SA 4.0"
    },
    {
      "id": "src-b",
      "title": "Источник B",
      "url": "https://example.org/b",
      "license": "CC0"
    }
  ],
  "items": [
    {
      "id": "c.a",
      "title": "Знание A",
      "tags": [
        "web"
      ],
      "fact": "Факт A, уточнённый во второй версии.",
      "explanation_short": "Коротко A.",
      "explanation_long": "**Подробно** A.",
      "refs": [
        {
          "source_id": "src-a",
          "quote": "Цитата A.",
          "quote_unverifiable": false
        }
      ],
      "review": {
        "status": "approved",
        "by": "tel",
        "notes": ""
      },
      "questions": [
        {
          "id": "c.a.q1",
          "type": "mcq",
          "prompt": "Выберите верные варианты.",
          "payload": {
            "options": [
              {
                "id": "a",
                "text": "Первый"
              },
              {
                "id": "b",
                "text": "Второй"
              },
              {
                "id": "c",
                "text": "Третий"
              }
            ],
            "correct": [
              "a",
              "c"
            ],
            "multiple": true
          }
        }
      ]
    },
    {
      "id": "c.c",
      "title": "Знание C",
      "tags": [],
      "fact": "Факт C.",
      "explanation_short": "Коротко C.",
      "explanation_long": "Подробно C.",
      "refs": [
        {
          "source_id": "src-a",
          "quote": "Цитата C."
        },
        {
          "source_id": "src-b",
          "quote": "Цитата C2."
        }
      ],
      "review": {
        "status": "approved",
        "by": "tel",
        "notes": "ок"
      },
      "questions": [
        {
          "id": "c.c.q1",
          "type": "flip",
          "prompt": "Лицевая сторона.",
          "payload": {
            "back": "Оборот."
          }
        },
        {
          "id": "c.c.q2",
          "type": "find_error",
          "prompt": "Найдите ошибочные строки.",
          "payload": {
            "mode": "text",
            "lines": [
              "Верно.",
              "Ошибка.",
              "Верно.",
              "Тоже ошибка."
            ],
            "error_lines": [
              2,
              4
            ],
            "line_explanations": {
              "2": "Потому что 2.",
              "4": "Потому что 4.",
              "1": "Строка 1 верна."
            }
          }
        }
      ]
    },
    {
      "id": "c.d",
      "title": "Знание D",
      "tags": [],
      "fact": "Факт C.",
      "explanation_short": "Коротко C.",
      "explanation_long": "Подробно C.",
      "refs": [
        {
          "source_id": "src-a",
          "quote": "Цитата C."
        },
        {
          "source_id": "src-b",
          "quote": "Цитата C2."
        }
      ],
      "review": {
        "status": "approved",
        "by": "tel",
        "notes": "ок"
      },
      "questions": [
        {
          "id": "c.d.q1",
          "type": "flip",
          "prompt": "Лицевая сторона.",
          "payload": {
            "back": "Оборот."
          }
        },
        {
          "id": "c.d.q2",
          "type": "find_error",
          "prompt": "Найдите ошибочные строки.",
          "payload": {
            "mode": "text",
            "lines": [
              "Верно.",
              "Ошибка.",
              "Верно.",
              "Тоже ошибка."
            ],
            "error_lines": [
              2,
              4
            ],
            "line_explanations": {
              "2": "Потому что 2.",
              "4": "Потому что 4.",
              "1": "Строка 1 верна."
            }
          }
        }
      ]
    }
  ]
}
